{
  "$schema": "../phase-manifest.schema.json",
  "branch": "feat/nxs-p02-tenancy",
  "closure_commit": null,
  "decision": "PENDING",
  "dependencies": [
    "NXS-P01"
  ],
  "evidence": [],
  "id": "NXS-P02",
  "implementation_commit": null,
  "mandatory_gates": [
    "p01_dependency",
    "git_synchronization",
    "execution_guard",
    "generic_phase_start",
    "requirements_ledger",
    "organization_domain",
    "organization_persistence",
    "organization_lifecycle",
    "optimistic_concurrency",
    "tenant_context",
    "trusted_resolver_boundary",
    "async_context_isolation",
    "tenant_unit_of_work",
    "tenant_orm_primitive",
    "tenant_namespace",
    "rls_enabled",
    "force_rls",
    "runtime_role_non_superuser",
    "runtime_role_no_bypassrls",
    "runtime_role_privilege_limits",
    "no_scope_protection",
    "cross_tenant_read_protection",
    "cross_tenant_write_protection",
    "cross_tenant_insert_protection",
    "cross_tenant_delete_protection",
    "pool_reuse_isolation",
    "rollback_isolation",
    "concurrent_tenant_isolation",
    "confused_deputy_protection",
    "migration_upgrade",
    "migration_validation",
    "migration_role_separation",
    "schema_tenancy_validator",
    "api_error_contracts",
    "structured_logging",
    "secret_data_redaction",
    "p01_api_regression",
    "formatting",
    "lint",
    "typing",
    "unit_tests",
    "integration_tests",
    "contract_tests",
    "security_tests",
    "concurrency_tests",
    "resilience_tests",
    "coverage",
    "dependency_audit",
    "sast",
    "secret_scan",
    "container_scan",
    "amd64_image",
    "arm64_image",
    "docker_non_root",
    "graceful_shutdown",
    "performance_smoke",
    "clean_room",
    "agent_handoff",
    "documentation",
    "regression",
    "github_ci"
  ],
  "non_scope": [
    "Authentication, passwords, JWT, OAuth, SSO, MFA, RBAC, users and memberships (NXS-P03)",
    "Automatic Organization Provisioner, default admin, quotas, plans, branding, channel and dashboard provisioning, cell scheduling (NXS-P05 / NXS-ORG-001)",
    "Dynamic dashboard schema generation (NXS-P05 / NXS-DASH-001)",
    "Customer identity and conversations (NXS-P06)",
    "Integration Hub and Tool Engine (NXS-P07 / NXS-P08)",
    "WhatsApp, email, SMS, OTP, telephony, ElevenLabs, agents, workflows, campaigns (later phases)",
    "Distributed event contracts and JetStream streams for tenant events (NXS-P04)",
    "Full tamper-evident audit ledger (NXS-P22 / NXS-AUDIT-002)",
    "Cell Scheduler and horizontal scaling (NXS-P18)",
    "Capacity certification and any 'N Organizations per VPS' claim (NXS-P28)",
    "Production deployment and Oracle Ampere A1 LAB provisioning"
  ],
  "objective": "Establish the permanent multi-tenant security boundary: an Organization core domain (UUIDv7 identity, reserved-safe key, validated profile, lifecycle state machine, optimistic concurrency), its first real persistence migration, and strict tenant isolation enforced in PostgreSQL by forced Row-Level Security, transaction-local tenant context, a non-bypass runtime database role, tenant-safe pooled transactions, a tenant namespace primitive and a schema-tenancy CI gate \u2014 proven against raw-SQL attacks, connection-pool reuse, concurrency, rollback, spoofed identifiers and role privilege escalation, on linux/amd64 and linux/arm64.",
  "requirements_implemented": [
    "NXS-TENANT-001",
    "NXS-TENANT-002",
    "NXS-TENANT-003",
    "NXS-TENANT-004",
    "NXS-TENANT-005",
    "NXS-ORG-002",
    "NXS-ORG-003",
    "NXS-SEC-003",
    "NXS-CICD-002"
  ],
  "schema_version": "1.0.0",
  "status": "BUILDING",
  "timestamps": {
    "closed_at": null,
    "started_at": "2026-09-07T06:02:42Z"
  },
  "title": "Multi-tenancy and Organizations Core"
}
