{
  "$schema": "../phase-manifest.schema.json",
  "branch": "feat/nxs-p19-sip-scaling",
  "closure_commit": null,
  "decision": "GO",
  "dependencies": [
    "NXS-P11",
    "NXS-P18"
  ],
  "evidence": [
    ".nxs/evidence/NXS-P19/admission-certification.json",
    ".nxs/evidence/NXS-P19/admission-container-scans.json",
    ".nxs/evidence/NXS-P19/admission-continuation-lock.json",
    ".nxs/evidence/NXS-P19/admission-development-history.json",
    ".nxs/evidence/NXS-P19/admission-interrupted-quality.json",
    ".nxs/evidence/NXS-P19/application-container-scan.json",
    ".nxs/evidence/NXS-P19/ari-permit-propagation.json",
    ".nxs/evidence/NXS-P19/artifact-provenance.json",
    ".nxs/evidence/NXS-P19/candidate-integrity.json",
    ".nxs/evidence/NXS-P19/ci-network-correction.json",
    ".nxs/evidence/NXS-P19/clean-room-before-observer-correction.json",
    ".nxs/evidence/NXS-P19/clean-room.json",
    ".nxs/evidence/NXS-P19/closure-criteria.json",
    ".nxs/evidence/NXS-P19/closure-documentation.json",
    ".nxs/evidence/NXS-P19/closure-lock.json",
    ".nxs/evidence/NXS-P19/closure.json",
    ".nxs/evidence/NXS-P19/concurrency.json",
    ".nxs/evidence/NXS-P19/container-provenance-before-log-confidentiality.json",
    ".nxs/evidence/NXS-P19/container-provenance-current.json",
    ".nxs/evidence/NXS-P19/continuation-lock.json",
    ".nxs/evidence/NXS-P19/contracts.json",
    ".nxs/evidence/NXS-P19/coverage.json",
    ".nxs/evidence/NXS-P19/criteria-contract-map.json",
    ".nxs/evidence/NXS-P19/development-checks.json",
    ".nxs/evidence/NXS-P19/development-protocol.json",
    ".nxs/evidence/NXS-P19/development-regression.json",
    ".nxs/evidence/NXS-P19/development-wire-continuation.json",
    ".nxs/evidence/NXS-P19/dialog-pinning.json",
    ".nxs/evidence/NXS-P19/docker.json",
    ".nxs/evidence/NXS-P19/documentation-certification.json",
    ".nxs/evidence/NXS-P19/edge-budget-and-log-correction.json",
    ".nxs/evidence/NXS-P19/egress-permit.json",
    ".nxs/evidence/NXS-P19/executed-test-nodes.json",
    ".nxs/evidence/NXS-P19/execution-criteria-attempt-1.json",
    ".nxs/evidence/NXS-P19/execution-criteria-before-edge-budget-correction.json",
    ".nxs/evidence/NXS-P19/execution-criteria-before-observer-correction.json",
    ".nxs/evidence/NXS-P19/execution-criteria.json",
    ".nxs/evidence/NXS-P19/external-final-audit-authorization.json",
    ".nxs/evidence/NXS-P19/git.json",
    ".nxs/evidence/NXS-P19/github-ci.json",
    ".nxs/evidence/NXS-P19/implementation-certification-history.json",
    ".nxs/evidence/NXS-P19/kamailio-config.json",
    ".nxs/evidence/NXS-P19/lifecycle-start.json",
    ".nxs/evidence/NXS-P19/locator-concurrency.json",
    ".nxs/evidence/NXS-P19/locator.json",
    ".nxs/evidence/NXS-P19/lock-observer-correction.json",
    ".nxs/evidence/NXS-P19/migration.json",
    ".nxs/evidence/NXS-P19/multiarch.json",
    ".nxs/evidence/NXS-P19/open-relay-security.json",
    ".nxs/evidence/NXS-P19/preflight.json",
    ".nxs/evidence/NXS-P19/quality-gates-attempt-1.json",
    ".nxs/evidence/NXS-P19/quality-gates.json",
    ".nxs/evidence/NXS-P19/quality-matrix.json",
    ".nxs/evidence/NXS-P19/regressions.json",
    ".nxs/evidence/NXS-P19/repository-final-validation.json",
    ".nxs/evidence/NXS-P19/resolver-authentication.json",
    ".nxs/evidence/NXS-P19/route-authorization.json",
    ".nxs/evidence/NXS-P19/schema-security.json",
    ".nxs/evidence/NXS-P19/security.json",
    ".nxs/evidence/NXS-P19/sip-protocol.json",
    ".nxs/evidence/NXS-P19/targets.json",
    ".nxs/evidence/NXS-P19/tests.json",
    ".nxs/evidence/NXS-P19/transport-certification.json",
    ".nxs/evidence/NXS-P19/transport-ci-budget-correction.json",
    ".nxs/evidence/NXS-P19/transport-container-scans.json",
    ".nxs/evidence/NXS-P19/transport-corrective-baseline.json",
    ".nxs/evidence/NXS-P19/transport-corrective-history.json",
    ".nxs/evidence/NXS-P19/transport-first-full-suite.json",
    ".nxs/evidence/NXS-P19/transport-quality-attempt-ca.json",
    ".nxs/evidence/NXS-P19/transport-quality-diagnostic.json",
    ".nxs/evidence/NXS-P19/validation-history.json"
  ],
  "id": "NXS-P19",
  "implementation_commit": "860d9a129adad75d0e4d7f8470c8a9d9f224a5be",
  "mandatory_gates": [
    "repository_integrity",
    "formatting",
    "lint",
    "typing",
    "unit_tests",
    "integration_tests",
    "contract_tests",
    "security_tests",
    "concurrency_tests",
    "resilience_tests",
    "coverage",
    "sast",
    "secret_scan",
    "dependency_security",
    "container_scan",
    "docker_build",
    "non_root_runtime",
    "graceful_shutdown",
    "migration_validation",
    "execution_guard",
    "generic_phase_start",
    "generic_closure",
    "generic_next_phase",
    "execution_lock",
    "phase_neutral_ci",
    "toolchain_consistency",
    "agent_handoff",
    "clean_room",
    "documentation",
    "regression",
    "github_ci"
  ],
  "non_scope": [
    "Organization relocation/cross-Cell failover, database sharding, active-call or media migration, RTPengine/media anchoring and transcoding",
    "Lossless edge failover, automatic carrier failover, Nomad orchestration, fleet autoscaling and frontend",
    "P20 Sentinel; P21 compliance; P22 full audit; P23 metering; P24 global observability; P25 automated recovery/reconciliation/failover; P26 DR; P27 final security hardening",
    "P28 capacity; P29 chaos/failover certification; P32 production infrastructure/deployment; unsupported throughput/SLA/RTO/RPO claims"
  ],
  "objective": "Implement the horizontally scalable Kamailio SIP signaling edge: canonical P11 DID ownership, P18 placement admission and PostgreSQL-authoritative P19 Cell SIP targets, pinned dialogs, trusted inbound/outbound peers and fail-closed relay security. Scope, acceptance criteria and implementation evidence obligations: docs/engineering/nxs-p19-sip-edge-scaling-design.md; ADR-0100.",
  "requirements_implemented": [
    "NXS-SCALE-002"
  ],
  "schema_version": "1.0.0",
  "status": "READY",
  "timestamps": {
    "closed_at": "2026-09-21T17:03:23Z",
    "started_at": "2026-09-19T19:31:44Z"
  },
  "title": "SIP Edge Scaling"
}
