{
  "$schema": "../phase-manifest.schema.json",
  "branch": "feat/nxs-p05-provisioner-dashboard",
  "closure_commit": null,
  "decision": "GO",
  "dependencies": [
    "NXS-P04"
  ],
  "evidence": [
    ".nxs/evidence/NXS-P05/agent-handoff.json",
    ".nxs/evidence/NXS-P05/auth-flows.json",
    ".nxs/evidence/NXS-P05/clean-room.json",
    ".nxs/evidence/NXS-P05/coverage.json",
    ".nxs/evidence/NXS-P05/cross-tenant-security.json",
    ".nxs/evidence/NXS-P05/dashboard-schema-unit.json",
    ".nxs/evidence/NXS-P05/database-roles.json",
    ".nxs/evidence/NXS-P05/docker.json",
    ".nxs/evidence/NXS-P05/git.json",
    ".nxs/evidence/NXS-P05/github-ci.json",
    ".nxs/evidence/NXS-P05/migration.json",
    ".nxs/evidence/NXS-P05/multiarch.json",
    ".nxs/evidence/NXS-P05/onboarding-validation.json",
    ".nxs/evidence/NXS-P05/preflight.json",
    ".nxs/evidence/NXS-P05/provisioning-concurrency.json",
    ".nxs/evidence/NXS-P05/provisioning-events.json",
    ".nxs/evidence/NXS-P05/provisioning-flows.json",
    ".nxs/evidence/NXS-P05/provisioning-resilience.json",
    ".nxs/evidence/NXS-P05/provisioning-security.json",
    ".nxs/evidence/NXS-P05/quality-gates.json",
    ".nxs/evidence/NXS-P05/quality-matrix.json",
    ".nxs/evidence/NXS-P05/rbac-api.json",
    ".nxs/evidence/NXS-P05/rbac.json",
    ".nxs/evidence/NXS-P05/rls.json",
    ".nxs/evidence/NXS-P05/runtime-role-security.json",
    ".nxs/evidence/NXS-P05/schema-validator.json",
    ".nxs/evidence/NXS-P05/secret-leakage.json",
    ".nxs/evidence/NXS-P05/security.json",
    ".nxs/evidence/NXS-P05/state-validation.json",
    ".nxs/evidence/NXS-P05/tests.json"
  ],
  "id": "NXS-P05",
  "implementation_commit": "dc29c845db13ea245010f5fffb458a3447ed1399",
  "mandatory_gates": [
    "repository_integrity",
    "formatting",
    "lint",
    "typing",
    "unit_tests",
    "integration_tests",
    "contract_tests",
    "security_tests",
    "concurrency_tests",
    "resilience_tests",
    "coverage",
    "sast",
    "secret_scan",
    "dependency_security",
    "container_scan",
    "docker_build",
    "non_root_runtime",
    "graceful_shutdown",
    "migration_validation",
    "execution_guard",
    "generic_phase_start",
    "generic_closure",
    "generic_next_phase",
    "execution_lock",
    "phase_neutral_ci",
    "toolchain_consistency",
    "agent_handoff",
    "clean_room",
    "documentation",
    "regression",
    "github_ci"
  ],
  "non_scope": [
    "Frontend / visual dashboard UI (backend schema and API contracts only)",
    "Customer identity and conversations (NXS-P06)",
    "Integration Hub and external API credentials (NXS-P07)",
    "Tool Engine (NXS-P08)",
    "Messaging channels, OTP, telephony, ElevenLabs, agent runtime, workflows, campaigns (later phases)",
    "CRM, billing, quotas, cell assignment, Sentinel, compliance, audit platform, metering (later phases)",
    "Settings write API beyond provisioning-time defaults (no P05-owned mutating settings surface)",
    "Dashboard configuration API (default baseline only; configuration surfaces belong to later phases)",
    "Email delivery for owner invitations (owner user must already exist)",
    "Production deployment (NXS-P32)"
  ],
  "objective": "Build the permanent enterprise Organization Provisioning foundation: a strongly validated onboarding contract, a durable idempotency ledger with canonical request fingerprints, a transactional OrganizationProvisioner that creates the Organization core record, the owner membership and org_owner assignment, P05-owned organization settings and the baseline dashboard configuration in explicit phases with crash-safe resume semantics, a platform-level organization:create capability, P04 transactional outbox events (organizations.provisioned), and a versioned, deterministic, permission-filtered dashboard schema backed by an allow-listed widget/data-source registry \u2014 all under P02 forced RLS, P03 live-state auth/RBAC and the P04 event platform, proven by the P05 unit/integration/security/concurrency/resilience/contract matrices and a clean-room validation on linux/amd64 and linux/arm64.",
  "requirements_implemented": [
    "NXS-DASH-001",
    "NXS-ORG-001"
  ],
  "schema_version": "1.0.0",
  "status": "READY",
  "timestamps": {
    "closed_at": "2026-09-07T20:57:25Z",
    "started_at": "2026-09-07T19:32:10Z"
  },
  "title": "Provisioner and Dashboard Schema"
}
