{
  "$schema": "../phase-manifest.schema.json",
  "branch": "feat/nxs-p20-sentinel",
  "closure_commit": null,
  "decision": "GO",
  "dependencies": [
    "NXS-P04",
    "NXS-P13",
    "NXS-P18"
  ],
  "evidence": [
    ".nxs/evidence/NXS-P20/access-recheck-20260926.json",
    ".nxs/evidence/NXS-P20/candidate-ci-pr.json",
    ".nxs/evidence/NXS-P20/candidate-ci-push-attempt-1.json",
    ".nxs/evidence/NXS-P20/candidate-ci-push.json",
    ".nxs/evidence/NXS-P20/candidate-security-pr.json",
    ".nxs/evidence/NXS-P20/candidate-security-push.json",
    ".nxs/evidence/NXS-P20/closure-blocker-stage-b-attempt-1.json",
    ".nxs/evidence/NXS-P20/closure-corrective-history.json",
    ".nxs/evidence/NXS-P20/closure-criteria.json",
    ".nxs/evidence/NXS-P20/closure-documentation.json",
    ".nxs/evidence/NXS-P20/closure-lock.json",
    ".nxs/evidence/NXS-P20/closure.json",
    ".nxs/evidence/NXS-P20/external-implementation-audit-authorization.json",
    ".nxs/evidence/NXS-P20/foundation-acceptance-map.json",
    ".nxs/evidence/NXS-P20/foundation-baseline.json",
    ".nxs/evidence/NXS-P20/foundation-concurrency.json",
    ".nxs/evidence/NXS-P20/foundation-database-role.json",
    ".nxs/evidence/NXS-P20/foundation-recovery.json",
    ".nxs/evidence/NXS-P20/foundation-schema.json",
    ".nxs/evidence/NXS-P20/foundation-security.json",
    ".nxs/evidence/NXS-P20/foundation-source-integrity.json",
    ".nxs/evidence/NXS-P20/foundation-tenant-isolation.json",
    ".nxs/evidence/NXS-P20/foundation-tests.json",
    ".nxs/evidence/NXS-P20/fullaccess-acceptance-map.json",
    ".nxs/evidence/NXS-P20/fullaccess-baseline.json",
    ".nxs/evidence/NXS-P20/fullaccess-concurrency.json",
    ".nxs/evidence/NXS-P20/fullaccess-containers.json",
    ".nxs/evidence/NXS-P20/fullaccess-database.json",
    ".nxs/evidence/NXS-P20/fullaccess-evidence-index.json",
    ".nxs/evidence/NXS-P20/fullaccess-exact-head.json",
    ".nxs/evidence/NXS-P20/fullaccess-history.json",
    ".nxs/evidence/NXS-P20/fullaccess-local-certification.json",
    ".nxs/evidence/NXS-P20/fullaccess-quality-matrix.json",
    ".nxs/evidence/NXS-P20/fullaccess-security.json",
    ".nxs/evidence/NXS-P20/fullaccess-source-integrity.json",
    ".nxs/evidence/NXS-P20/fullaccess-targeted-tests.json",
    ".nxs/evidence/NXS-P20/fullaccess-test-inventory.json",
    ".nxs/evidence/NXS-P20/lifecycle-corrective-stale-lock-ci-pr.json",
    ".nxs/evidence/NXS-P20/lifecycle-corrective-stale-lock-ci-push.json",
    ".nxs/evidence/NXS-P20/local-acceptance-status.json",
    ".nxs/evidence/NXS-P20/local-concurrency-status.json",
    ".nxs/evidence/NXS-P20/local-development-status.json",
    ".nxs/evidence/NXS-P20/quality-gates-stage-b-attempt-1.json",
    ".nxs/evidence/NXS-P20/quality-gates.json",
    ".nxs/evidence/NXS-P20/quality-matrix.json",
    ".nxs/evidence/NXS-P20/tests-stage-b-attempt-1.json",
    ".nxs/evidence/NXS-P20/tests.json"
  ],
  "id": "NXS-P20",
  "implementation_commit": "53657b176e47b7bb34ff039fa2dc6047556b77d2",
  "mandatory_gates": [
    "repository_integrity",
    "formatting",
    "lint",
    "typing",
    "unit_tests",
    "integration_tests",
    "contract_tests",
    "security_tests",
    "concurrency_tests",
    "resilience_tests",
    "coverage",
    "sast",
    "secret_scan",
    "dependency_security",
    "container_scan",
    "docker_build",
    "non_root_runtime",
    "graceful_shutdown",
    "migration_validation",
    "execution_guard",
    "generic_phase_start",
    "generic_closure",
    "generic_next_phase",
    "execution_lock",
    "phase_neutral_ci",
    "toolchain_consistency",
    "agent_handoff",
    "clean_room",
    "documentation",
    "regression",
    "github_ci"
  ],
  "non_scope": [
    "Production deployment, release promotion, arbitrary Git writes/merges, infrastructure provisioning or configuration drift remediation; P32 owns production deployment",
    "Automatic Cell/carrier/service failover, active-session relocation, generic reconciliation or self-healing; P25 owns resilience/recovery and P29 chaos/failover certification",
    "Full metrics/logs/traces observability platform, fleet-wide telemetry retention or SLO certification; P24 owns global observability",
    "Compliance policy certification, immutable enterprise audit platform, metering/cost accounting, backup/DR, final security hardening and capacity certification; P21-P28 remain separate",
    "Arbitrary shell, SQL, HTTP destinations, SSH, credential exposure, tenant-authored executable runbooks, destructive actions, privilege escalation or bypass of P04/P08/P13/P18 authority",
    "Frontend/operator console certification and unsupported claims of autonomous production remediation, SLA, RTO/RPO, capacity or zero-touch operations"
  ],
  "objective": "Implement NXS Sentinel as a constrained platform SRE control plane: trusted bounded signal ingestion, incident correlation, evidence-bound platform reasoning, versioned runbook proposals, durable approval/policy decisions, and fenced execution through source-registered platform SRE adapters. P20 does not execute tenant business mutations and must not synthesize tenant principals or reuse tenant P13/P08 persistence as global infrastructure authority. Architecture and acceptance contract: docs/engineering/nxs-p20-sentinel-design.md; ADR-0101.",
  "requirements_implemented": [
    "NXS-SRE-001"
  ],
  "schema_version": "1.0.0",
  "status": "READY",
  "timestamps": {
    "closed_at": "2026-09-27T11:09:08Z",
    "started_at": "2026-09-25T23:45:09Z"
  },
  "title": "NXS Sentinel"
}
